{
  "schemaVersion": 1,
  "auditId": "AUD-008",
  "auditNumber": 8,
  "date": "2026-09-12",
  "title": "Independent-audit remediation verification — 2026-09-12",
  "reviewer": {
    "name": null,
    "model": "gpt-6-astra",
    "reasoningEffort": null,
    "metadataNote": "Not recorded by the reviewing client.",
    "recordedDetails": {
      "vendor": "OpenAI",
      "model": "GPT-6 Astra",
      "harness": "Codex desktop app",
      "exactServiceSnapshotAvailable": false
    }
  },
  "snapshot": {
    "commit": "cae5fab94a66d7840c39d2a5d522b70395117fed",
    "commitComplete": true,
    "workingTree": "clean",
    "sourceFingerprint": null,
    "note": "Original snapshot metadata; normalization does not constitute a new review. Unknown or abbreviated values are not reconstructed."
  },
  "scope": {
    "recordedIn": "Markdown evidence sections",
    "note": "Original scope and exclusions are preserved; no additional review coverage is claimed."
  },
  "checks": {
    "canonicalVerification": {
      "command": "./tooling/build-reproducible.sh",
      "result": "passed",
      "vitestFiles": 84,
      "vitestTests": 1071,
      "rust": {
        "passed": 12,
        "failed": 0,
        "ignoredFixtureHelper": 1
      },
      "deterministicHtmlBuilds": 2,
      "wasmByteMatch": true,
      "verificationRecordSha256": "c43c64672a4ca547f265d50282454ff1738784857e9274a4afc987e199190be8"
    },
    "browsers": {
      "chromium": "151.0.7922.34",
      "firefox": "153.0",
      "directFile": {
        "passed": 16,
        "total": 16,
        "evidence": "<worktree>/test-results/browser-files/2026-09-12T13-51-41.344Z"
      },
      "extendedRegression": {
        "passed": 38,
        "total": 38,
        "evidence": "<worktree>/test-results/browser-regressions/2026-09-12T13-53-05.244Z"
      }
    }
  },
  "findings": [],
  "observations": [],
  "remediation": [
    {
      "id": "AUD-007-SEC001",
      "status": "verified",
      "recordedDisposition": "corrected-and-tested",
      "fixCommit": null,
      "verificationCommit": "cae5fab94a66d7840c39d2a5d522b70395117fed",
      "evidence": "audit-08-2026-09-12.md",
      "note": "Disposition in this historical follow-up, not a claim about the current code; partial mitigation remains open."
    },
    {
      "id": "AUD-007-FUN001",
      "status": "verified",
      "recordedDisposition": "corrected-and-tested",
      "fixCommit": null,
      "verificationCommit": "cae5fab94a66d7840c39d2a5d522b70395117fed",
      "evidence": "audit-08-2026-09-12.md",
      "note": "Disposition in this historical follow-up, not a claim about the current code; partial mitigation remains open."
    },
    {
      "id": "AUD-007-UI001",
      "status": "verified",
      "recordedDisposition": "corrected-and-tested",
      "fixCommit": null,
      "verificationCommit": "cae5fab94a66d7840c39d2a5d522b70395117fed",
      "evidence": "audit-08-2026-09-12.md",
      "note": "Disposition in this historical follow-up, not a claim about the current code; partial mitigation remains open."
    },
    {
      "id": "AUD-007-FUN002",
      "status": "verified",
      "recordedDisposition": "selected-deterministic-relationships-corrected-and-tested",
      "fixCommit": null,
      "verificationCommit": "cae5fab94a66d7840c39d2a5d522b70395117fed",
      "evidence": "audit-08-2026-09-12.md",
      "note": "Disposition in this historical follow-up, not a claim about the current code; partial mitigation remains open."
    },
    {
      "id": "AUD-007-BLD001",
      "status": "verified",
      "recordedDisposition": "corrected-and-tested",
      "fixCommit": null,
      "verificationCommit": "cae5fab94a66d7840c39d2a5d522b70395117fed",
      "evidence": "audit-08-2026-09-12.md",
      "note": "Disposition in this historical follow-up, not a claim about the current code; partial mitigation remains open."
    },
    {
      "id": "AUD-007-BLD002",
      "status": "verified",
      "recordedDisposition": "corrected-and-tested",
      "fixCommit": null,
      "verificationCommit": "cae5fab94a66d7840c39d2a5d522b70395117fed",
      "evidence": "audit-08-2026-09-12.md",
      "note": "Disposition in this historical follow-up, not a claim about the current code; partial mitigation remains open."
    }
  ],
  "limitations": {
    "recordedIn": "audit-08-2026-09-12.md",
    "note": "Unknown execution details are not supplied by normalization."
  },
  "normalization": {
    "date": "2026-09-18",
    "kind": "documentation-only",
    "standard": "AUDIT_STANDARD.md",
    "legacyMapping": "LEGACY_FINDING_IDS.json",
    "note": "Original results, dates, snapshots and evidence are retained. Null fields mean not recorded, not passed or resolved. No audit commands were re-executed as part of this migration."
  },
  "historicalEvidence": {
    "report": "docs/audits/audit-08-2026-09-12.md",
    "model": "gpt-6-astra",
    "reasoningEffort": null,
    "reasoningEffortNote": "Not recorded by the reviewing client.",
    "completedAt": {
      "utc": "2026-09-12T13:54:53Z"
    },
    "repository": {
      "path": "<worktree>",
      "branch": "hobby-eng-psbt-inspector-v4",
      "verifiedCommit": "cae5fab94a66d7840c39d2a5d522b70395117fed",
      "version": "0.1.4",
      "released": false,
      "dirtyAtVerification": false
    },
    "artifacts": {
      "multiChain": {
        "Wallet_Activity_Viewer.html": "c3134c8e87d335abc64d2f5aea8cf1b66f4ae6a09a6457f53286b10f5c8f0dbe",
        "Wallet_Discovery_Scanner.html": "effbcc522faa203f074ec09247a554e13fead2d107241fe4e5378d15b1975647",
        "Wallet_Key_Derivation_Tool.html": "3c67602b573852b11bb4792cc0eb6b8a41766465e6d96772de5a56b4cb548028",
        "PSBT_Multisig_Inspector.html": "c5cfbf2f919dc8714f4b19d3ab5450cc25abaa2f5f43240de1f21f2fcfdee5a1"
      },
      "dashCommunity": {
        "Dash_Community_Activity_Viewer.html": "6c7d828d6ad011547335068857026f70213a04e4109a3aaf0546b73df4bf8b1b",
        "Dash_Community_Discovery_Scanner.html": "de6c5d5d44592254a953fcef84babe8d33009813a52e5e14f18296504973d4b3",
        "Dash_Community_Key_Derivation_Tool.html": "1b206e4132db77948f11571dc0d5b06b6e1eda543180f6a2156374c7d540a1fe",
        "Dash_Community_PSBT_Multisig_Inspector.html": "3fdabb7bc09c8586131dfdf181fe6ed0ccc8f4e8b59743594853f541b2d8c811"
      }
    },
    "releaseAssessment": "release-candidate-review",
    "published": false
  }
}
