{
  "schemaVersion": 1,
  "auditId": "AUD-003",
  "auditNumber": 3,
  "date": "2026-09-09",
  "title": "Repeat-audit remediation — 2026-09-09",
  "reviewer": {
    "name": null,
    "model": null,
    "reasoningEffort": null,
    "metadataNote": "Only reviewer metadata actually retained in the original report is used."
  },
  "snapshot": {
    "commit": "e1cdb67fb3625132d73d2c382563a12aa2587705",
    "commitComplete": true,
    "workingTree": "Remediation of the reviewed baseline; no fresh full acceptance claimed.",
    "sourceFingerprint": null,
    "note": "Original snapshot metadata; normalization does not constitute a new review. Unknown or abbreviated values are not reconstructed."
  },
  "scope": {
    "recordedIn": "Markdown evidence sections",
    "note": "Original scope and exclusions are preserved; no additional review coverage is claimed."
  },
  "checks": {
    "recordedIn": "Markdown evidence sections"
  },
  "findings": [
    {
      "id": "AUD-003-API001",
      "legacyId": "R01",
      "category": "API",
      "kind": "finding",
      "title": "token supply exported as credits",
      "severity": null,
      "status": "fixed",
      "releaseBlocking": null,
      "legacyPriority": "P2",
      "correction": "CSV/XLSX token rows leave DASH amount fields empty and preserve token ID, supply and decimals as metadata. JSON remains token-typed.",
      "evidence": "Real CSV, generated XLSX XML and JSON assertions in Activity Viewer export tests.",
      "reproduction": null,
      "expected": null,
      "observed": null,
      "impact": null,
      "recommendedFix": null,
      "requiredVerification": null
    },
    {
      "id": "AUD-003-FUN001",
      "legacyId": "R02",
      "category": "FUN",
      "kind": "finding",
      "title": "Ethereum case duplicates",
      "severity": null,
      "status": "fixed",
      "releaseBlocking": null,
      "legacyPriority": "P2",
      "correction": "Canonical address identity is deduplicated before lookup and aggregation.",
      "evidence": "One account in different case forms plus a distinct control yields two queries and 2 ETH, not three.",
      "reproduction": null,
      "expected": null,
      "observed": null,
      "impact": null,
      "recommendedFix": null,
      "requiredVerification": null
    },
    {
      "id": "AUD-003-API002",
      "legacyId": "R03",
      "category": "API",
      "kind": "finding",
      "title": "Identity history integrity",
      "severity": null,
      "status": "fixed",
      "releaseBlocking": null,
      "legacyPriority": "P2",
      "correction": "Summary counts, stable page totals and collection identities are checked. Missing counts are explicitly unverified; bounded results retain display-limit warnings. Scanner transfer summaries use the same integrity guard.",
      "evidence": "150 unique records, overlap, missing/unknown count, changed count, premature end, resource revision duplicate, and legitimate transfer legs.",
      "reproduction": null,
      "expected": null,
      "observed": null,
      "impact": null,
      "recommendedFix": null,
      "requiredVerification": null
    },
    {
      "id": "AUD-003-FUN002",
      "legacyId": "R04",
      "category": "FUN",
      "kind": "finding",
      "title": "stale cross-query state",
      "severity": null,
      "status": "fixed",
      "releaseBlocking": null,
      "legacyPriority": "P2",
      "correction": "Removed retained Bitcoin balance state and retained Platform Explorer synchronization responses. First-party HTTP bypasses browser caching.",
      "evidence": "Same service observes 100 then 0 satoshis; a new query rejects a newly unsynchronized Explorer.",
      "reproduction": null,
      "expected": null,
      "observed": null,
      "impact": null,
      "recommendedFix": null,
      "requiredVerification": null
    },
    {
      "id": "AUD-003-FUN003",
      "legacyId": "R05",
      "category": "FUN",
      "kind": "finding",
      "title": "partial Orchard accounting",
      "severity": null,
      "status": "fixed",
      "releaseBlocking": null,
      "legacyPriority": "P2",
      "correction": "Completion context reaches note presentation, section metrics, aggregate, CSV/JSON and seed/public scan status. Unknown balance is nullable; observed note value and known spend remain available.",
      "evidence": "Same ledger rendered partial/complete and exported; observed spend stays spent; empty IVK scan remains unavailable; both controller source modes report incomplete.",
      "reproduction": null,
      "expected": null,
      "observed": null,
      "impact": null,
      "recommendedFix": null,
      "requiredVerification": null
    },
    {
      "id": "AUD-003-API003",
      "legacyId": "R06",
      "category": "API",
      "kind": "finding",
      "title": "address checksums",
      "severity": null,
      "status": "fixed",
      "releaseBlocking": null,
      "legacyPriority": "P2",
      "correction": "Shared Bitcoin Base58Check/witness decoders and Ethereum EIP-55 validation run in UI and network boundary. Complete batch screening precedes networking; detected secrets are erased.",
      "evidence": "Corrupted checksum, wrong network, witness version/checksum/length mismatch, uppercase positive control, Ethereum checksum cases and zero-request private-input test.",
      "reproduction": null,
      "expected": null,
      "observed": null,
      "impact": null,
      "recommendedFix": null,
      "requiredVerification": null
    },
    {
      "id": "AUD-003-DOC001",
      "legacyId": "D01",
      "category": "DOC",
      "kind": "finding",
      "title": "native Rust selection",
      "severity": null,
      "status": "fixed",
      "releaseBlocking": null,
      "legacyPriority": "P3",
      "correction": "Native commands explicitly select the pinned installed toolchain with `RUSTUP_TOOLCHAIN`.",
      "evidence": "Instructions now distinguish installing from selecting the toolchain.",
      "reproduction": null,
      "expected": null,
      "observed": null,
      "impact": null,
      "recommendedFix": null,
      "requiredVerification": null
    },
    {
      "id": "AUD-003-DOC002",
      "legacyId": "D02",
      "category": "DOC",
      "kind": "finding",
      "title": "documentation drift",
      "severity": null,
      "status": "fixed",
      "releaseBlocking": null,
      "legacyPriority": "P3",
      "correction": "Corrected immutable audit metadata description, recorded historical browser acceptance, removed future-bundle wording, and documented current input/completeness/export behavior.",
      "evidence": "Metadata/link consistency checks; source-to-prose review.",
      "reproduction": null,
      "expected": null,
      "observed": null,
      "impact": null,
      "recommendedFix": null,
      "requiredVerification": null
    }
  ],
  "observations": [],
  "remediation": [],
  "limitations": {
    "recordedIn": "audit-03-2026-09-09.md",
    "note": "Unknown execution details are not supplied by normalization."
  },
  "normalization": {
    "date": "2026-09-18",
    "kind": "documentation-only",
    "standard": "AUDIT_STANDARD.md",
    "legacyMapping": "LEGACY_FINDING_IDS.json",
    "note": "Original results, dates, snapshots and evidence are retained. Null fields mean not recorded, not passed or resolved. No audit commands were re-executed as part of this migration."
  },
  "historicalEvidence": {}
}
